2021-04-25 14:17:22,10.177.15.166,192.144.198.149,219,Ether / IP / TCP 10.177.15.166:50869 > 192.144.198.149:7826 PA / Raw,50869,7826,TCP,good
2021-04-25 14:17:22,192.144.198.149,10.177.15.166,218,Ether / IP / TCP 192.144.198.149:7826 > 10.177.15.166:50869 PA / Raw,7826,50869,TCP,good
2021-04-25 14:17:22,10.177.15.166,180.101.49.54,672,Ether / IP / TCP / TLS 10.177.15.166:50977 > 180.101.49.54:443 / TLS / TLS Application Data,50977,443,HTTPS,good
2021-04-25 14:17:22,10.177.15.166,192.144.198.149,54,Ether / IP / TCP 10.177.15.166:50869 > 192.144.198.149:7826 A,50869,7826,TCP,good
2021-04-25 14:17:22,180.101.49.54,10.177.15.166,60,Ether / IP / TCP 180.101.49.54:https > 10.177.15.166:50977 A / Padding,443,50977,HTTPS,good
2021-04-25 14:17:22,180.101.49.54,10.177.15.166,116,Ether / IP / TCP / TLS 180.101.49.54:443 > 10.177.15.166:50977 / TLS / TLS Application Data,443,50977,HTTPS,good
2021-04-25 14:17:22,10.177.15.166,180.101.49.54,54,Ether / IP / TCP 10.177.15.166:50977 > 180.101.49.54:https A,50977,443,HTTPS,good
2021-04-25 14:17:24,10.177.15.166,222.188.43.131,55,Ether / IP / TCP 10.177.15.166:50959 > 222.188.43.131:https A / _TLSEncryptedContent,50959,443,HTTPS,good
2021-04-25 14:17:24,222.188.43.131,10.177.15.166,60,Ether / IP / TCP 222.188.43.131:https > 10.177.15.166:50959 A / Padding,443,50959,HTTPS,good
2021-04-25 14:17:24,10.177.15.166,192.144.198.149,218,Ether / IP / TCP 10.177.15.166:50862 > 192.144.198.149:7826 PA / Raw,50862,7826,TCP,good
2021-04-25 14:17:24,192.144.198.149,10.177.15.166,217,Ether / IP / TCP 192.144.198.149:7826 > 10.177.15.166:50862 PA / Raw,7826,50862,TCP,good
2021-04-25 14:17:24,10.177.15.166,192.144.198.149,54,Ether / IP / TCP 10.177.15.166:50862 > 192.144.198.149:7826 A,50862,7826,TCP,good
2021-04-25 14:17:25,10.177.15.166,180.101.49.54,671,Ether / IP / TCP / TLS 10.177.15.166:50977 > 180.101.49.54:443 / TLS / TLS Application Data,50977,443,HTTPS,good
2021-04-25 14:17:25,180.101.49.54,10.177.15.166,60,Ether / IP / TCP 180.101.49.54:https > 10.177.15.166:50977 A / Padding,443,50977,HTTPS,good
2021-04-25 14:17:25,180.101.49.54,10.177.15.166,116,Ether / IP / TCP / TLS 180.101.49.54:443 > 10.177.15.166:50977 / TLS / TLS Application Data,443,50977,HTTPS,good
2021-04-25 14:17:25,10.177.15.166,180.101.49.54,54,Ether / IP / TCP 10.177.15.166:50977 > 180.101.49.54:https A,50977,443,HTTPS,good
2021-04-25 14:17:27,10.177.15.166,192.144.198.149,219,Ether / IP / TCP 10.177.15.166:50865 > 192.144.198.149:7826 PA / Raw,50865,7826,TCP,good
2021-04-25 14:17:27,192.144.198.149,10.177.15.166,218,Ether / IP / TCP 192.144.198.149:7826 > 10.177.15.166:50865 PA / Raw,7826,50865,TCP,good
2021-04-25 14:17:27,10.177.15.166,192.144.198.149,54,Ether / IP / TCP 10.177.15.166:50865 > 192.144.198.149:7826 A,50865,7826,TCP,good
2021-04-25 14:17:28,10.177.15.166,180.101.49.54,672,Ether / IP / TCP / TLS 10.177.15.166:50977 > 180.101.49.54:443 / TLS / TLS Application Data,50977,443,HTTPS,good
2021-04-25 14:17:28,180.101.49.54,10.177.15.166,60,Ether / IP / TCP 180.101.49.54:https > 10.177.15.166:50977 A / Padding,443,50977,HTTPS,good
2021-04-25 14:17:28,180.101.49.54,10.177.15.166,116,Ether / IP / TCP / TLS 180.101.49.54:443 > 10.177.15.166:50977 / TLS / TLS Application Data,443,50977,HTTPS,good
2021-04-25 14:17:28,10.177.15.166,180.101.49.54,54,Ether / IP / TCP 10.177.15.166:50977 > 180.101.49.54:https A,50977,443,HTTPS,good
2021-04-25 14:17:28,10.177.15.166,202.117.112.3,90,Ether / IP / UDP / DNS Qry "b'smartscreen-prod.microsoft.com.'" ,63365,53,DNS,good
2021-04-25 14:17:28,202.117.112.3,10.177.15.166,224,Ether / IP / UDP / DNS Ans "b'wd-prod-ss.trafficmanager.net.'" ,53,63365,DNS,good
2021-04-25 14:17:28,10.177.15.166,13.67.52.249,74,Ether / IP / TCP 10.177.15.166:50990 > 13.67.52.249:https S,50990,443,HTTPS,good
2021-04-25 14:17:29,10.177.15.166,13.67.52.249,74,Ether / IP / TCP 10.177.15.166:50990 > 13.67.52.249:https S,50990,443,HTTPS,good
2021-04-25 14:17:30,10.177.15.166,120.133.59.12,74,Ether / IP / TCP 10.177.15.166:50991 > 120.133.59.12:https S,50991,443,HTTPS,good
2021-04-25 14:17:30,120.133.59.12,10.177.15.166,66,Ether / IP / TCP 120.133.59.12:https > 10.177.15.166:50991 SA,443,50991,HTTPS,good
2021-04-25 14:17:30,10.177.15.166,120.133.59.12,54,Ether / IP / TCP 10.177.15.166:50991 > 120.133.59.12:https A,50991,443,HTTPS,good
2021-04-25 14:17:30,10.177.15.166,120.133.59.12,251,Ether / IP / TCP / TLS 10.177.15.166:50991 > 120.133.59.12:443 / TLS / TLS Handshake - Client Hello,50991,443,HTTPS,good
2021-04-25 14:17:30,120.133.59.12,10.177.15.166,60,Ether / IP / TCP 120.133.59.12:https > 10.177.15.166:50991 A / Padding,443,50991,HTTPS,good
2021-04-25 14:17:30,120.133.59.12,10.177.15.166,1502,Ether / IP / TCP / TLS / TLS 120.133.59.12:443 > 10.177.15.166:50991 / TLS / Raw,443,50991,HTTPS,good
2021-04-25 14:17:30,120.133.59.12,10.177.15.166,1502,Ether / IP / TCP 120.133.59.12:https > 10.177.15.166:50991 A / _TLSEncryptedContent,443,50991,HTTPS,good
2021-04-25 14:17:30,120.133.59.12,10.177.15.166,566,Ether / IP / TCP 120.133.59.12:https > 10.177.15.166:50991 PA / _TLSEncryptedContent,443,50991,HTTPS,good
2021-04-25 14:17:30,10.177.15.166,120.133.59.12,54,Ether / IP / TCP 10.177.15.166:50991 > 120.133.59.12:https A,50991,443,HTTPS,good
2021-04-25 14:17:30,10.177.15.166,120.133.59.12,147,Ether / IP / TCP / TLS / TLS / TLS 10.177.15.166:50991 > 120.133.59.12:443 / TLS / TLS Handshake - Hello Request / TLS Handshake - Hello Request / Raw,50991,443,HTTPS,good
2021-04-25 14:17:30,120.133.59.12,10.177.15.166,328,Ether / IP / TCP / TLS / TLS / TLS 120.133.59.12:443 > 10.177.15.166:50991 / TLS / Raw,443,50991,HTTPS,good
2021-04-25 14:17:30,10.177.15.166,120.133.59.12,228,Ether / IP / TCP / TLS 10.177.15.166:50991 > 120.133.59.12:443 / TLS / TLS Application Data,50991,443,HTTPS,good
2021-04-25 14:17:30,10.177.15.166,120.133.59.12,443,Ether / IP / TCP / TLS 10.177.15.166:50991 > 120.133.59.12:443 / TLS / TLS Application Data,50991,443,HTTPS,good
2021-04-25 14:17:30,120.133.59.12,10.177.15.166,60,Ether / IP / TCP 120.133.59.12:https > 10.177.15.166:50991 A / Padding,443,50991,HTTPS,good
2021-04-25 14:17:30,120.133.59.12,10.177.15.166,226,Ether / IP / TCP / TLS 120.133.59.12:443 > 10.177.15.166:50991 / TLS / TLS Application Data,443,50991,HTTPS,good
2021-04-25 14:17:30,10.177.15.166,120.133.59.12,54,Ether / IP / TCP 10.177.15.166:50991 > 120.133.59.12:https A,50991,443,HTTPS,good
2021-04-25 14:17:31,10.177.15.166,180.101.49.54,1502,Ether / IP / TCP / TLS 10.177.15.166:50898 > 180.101.49.54:443 / TLS / TLS Application Data,50898,443,HTTPS,good
2021-04-25 14:17:31,10.177.15.166,180.101.49.54,1502,Ether / IP / TCP 10.177.15.166:50898 > 180.101.49.54:https A / _TLSEncryptedContent,50898,443,HTTPS,good
2021-04-25 14:17:31,10.177.15.166,180.101.49.54,778,Ether / IP / TCP 10.177.15.166:50898 > 180.101.49.54:https PA / _TLSEncryptedContent,50898,443,HTTPS,good
2021-04-25 14:17:31,180.101.49.54,10.177.15.166,60,Ether / IP / TCP 180.101.49.54:https > 10.177.15.166:50898 A / Padding,443,50898,HTTPS,good
2021-04-25 14:17:31,180.101.49.54,10.177.15.166,60,Ether / IP / TCP 180.101.49.54:https > 10.177.15.166:50898 A / Padding,443,50898,HTTPS,good
2021-04-25 14:17:31,180.101.49.54,10.177.15.166,340,Ether / IP / TCP / TLS 180.101.49.54:443 > 10.177.15.166:50898 / TLS / TLS Application Data,443,50898,HTTPS,good
2021-04-25 14:17:31,180.101.49.54,10.177.15.166,195,Ether / IP / TCP / TLS 180.101.49.54:443 > 10.177.15.166:50898 / TLS / TLS Application Data,443,50898,HTTPS,good
2021-04-25 14:17:31,10.177.15.166,13.67.52.249,74,Ether / IP / TCP 10.177.15.166:50990 > 13.67.52.249:https S,50990,443,HTTPS,good
2021-04-25 14:17:32,10.177.15.166,180.101.49.54,672,Ether / IP / TCP / TLS 10.177.15.166:50977 > 180.101.49.54:443 / TLS / TLS Application Data,50977,443,HTTPS,good
2021-04-25 14:17:32,180.101.49.54,10.177.15.166,60,Ether / IP / TCP 180.101.49.54:https > 10.177.15.166:50977 A / Padding,443,50977,HTTPS,good
2021-04-25 14:17:32,180.101.49.54,10.177.15.166,116,Ether / IP / TCP / TLS 180.101.49.54:443 > 10.177.15.166:50977 / TLS / TLS Application Data,443,50977,HTTPS,good
2021-04-25 14:17:32,10.177.15.166,180.101.49.54,54,Ether / IP / TCP 10.177.15.166:50977 > 180.101.49.54:https A,50977,443,HTTPS,good
2021-04-25 14:17:33,94:db:da:3e:8f:cf,de:5b:af:bd:f8:a6,ARP,56,Ether / ARP who has 10.177.15.166 says 10.177.255.254 / Padding,UnKnow,UnKnow,good
2021-04-25 14:17:33,de:5b:af:bd:f8:a6,94:db:da:3e:8f:cf,ARP,42,Ether / ARP is at de:5b:af:bd:f8:a6 says 10.177.15.166,UnKnow,UnKnow,good
2021-04-25 14:17:35,10.177.15.166,180.101.49.54,672,Ether / IP / TCP / TLS 10.177.15.166:50977 > 180.101.49.54:443 / TLS / TLS Application Data,50977,443,HTTPS,good
2021-04-25 14:17:35,180.101.49.54,10.177.15.166,60,Ether / IP / TCP 180.101.49.54:https > 10.177.15.166:50977 A / Padding,443,50977,HTTPS,good
2021-04-25 14:17:35,180.101.49.54,10.177.15.166,116,Ether / IP / TCP / TLS 180.101.49.54:443 > 10.177.15.166:50977 / TLS / TLS Application Data,443,50977,HTTPS,good
2021-04-25 14:17:35,10.177.15.166,180.101.49.54,54,Ether / IP / TCP 10.177.15.166:50977 > 180.101.49.54:https A,50977,443,HTTPS,good
2021-04-25 14:17:35,10.177.15.166,52.139.250.253,55,Ether / IP / TCP 10.177.15.166:50860 > 52.139.250.253:https A / _TLSEncryptedContent,50860,443,HTTPS,good
2021-04-25 14:17:35,52.139.250.253,10.177.15.166,66,Ether / IP / TCP 52.139.250.253:https > 10.177.15.166:50860 A,443,50860,HTTPS,good
2021-04-25 14:17:35,10.177.15.166,13.67.52.249,74,Ether / IP / TCP 10.177.15.166:50990 > 13.67.52.249:https S,50990,443,HTTPS,good
2021-04-25 14:17:37,192.144.198.149,10.177.15.166,60,Ether / IP / TCP 192.144.198.149:7826 > 10.177.15.166:50869 A / Padding,7826,50869,TCP,good
2021-04-25 14:17:37,10.177.15.166,192.144.198.149,54,Ether / IP / TCP 10.177.15.166:50869 > 192.144.198.149:7826 A,50869,7826,TCP,good
2021-04-25 14:17:38,10.177.15.166,180.101.49.54,672,Ether / IP / TCP / TLS 10.177.15.166:50977 > 180.101.49.54:443 / TLS / TLS Application Data,50977,443,HTTPS,good
2021-04-25 14:17:38,180.101.49.54,10.177.15.166,60,Ether / IP / TCP 180.101.49.54:https > 10.177.15.166:50977 A / Padding,443,50977,HTTPS,good
2021-04-25 14:17:38,180.101.49.54,10.177.15.166,116,Ether / IP / TCP / TLS 180.101.49.54:443 > 10.177.15.166:50977 / TLS / TLS Application Data,443,50977,HTTPS,good
2021-04-25 14:17:38,10.177.15.166,180.101.49.54,54,Ether / IP / TCP 10.177.15.166:50977 > 180.101.49.54:https A,50977,443,HTTPS,good
2021-04-25 14:17:39,10.177.15.166,222.188.43.131,155,Ether / IP / TCP / TLS 10.177.15.166:50959 > 222.188.43.131:443 / TLS / TLS Application Data,50959,443,HTTPS,good
2021-04-25 14:17:39,10.177.15.166,222.188.43.131,100,Ether / IP / TCP / TLS 10.177.15.166:50959 > 222.188.43.131:443 / TLS / TLS Application Data,50959,443,HTTPS,good
2021-04-25 14:17:39,222.188.43.131,10.177.15.166,100,Ether / IP / TCP / TLS 222.188.43.131:443 > 10.177.15.166:50959 / TLS / TLS Application Data,443,50959,HTTPS,good
2021-04-25 14:17:39,222.188.43.131,10.177.15.166,85,Ether / IP / TCP / TLS 222.188.43.131:443 > 10.177.15.166:50959 / TLS / TLS Alert,443,50959,HTTPS,good
2021-04-25 14:17:39,10.177.15.166,222.188.43.131,54,Ether / IP / TCP 10.177.15.166:50959 > 222.188.43.131:https A,50959,443,HTTPS,good
2021-04-25 14:17:39,10.177.15.166,222.188.43.131,54,Ether / IP / TCP 10.177.15.166:50959 > 222.188.43.131:https FA,50959,443,HTTPS,good
2021-04-25 14:17:39,222.188.43.131,10.177.15.166,60,Ether / IP / TCP 222.188.43.131:https > 10.177.15.166:50959 R / Padding,443,50959,HTTPS,good
2021-04-25 14:17:39,222.188.43.131,10.177.15.166,60,Ether / IP / TCP 222.188.43.131:https > 10.177.15.166:50959 R / Padding,443,50959,HTTPS,good
2021-04-25 14:17:39,10.177.15.166,202.117.112.3,80,Ether / IP / UDP / DNS Qry "b'message.bilibili.com.'" ,52687,53,DNS,good
2021-04-25 14:17:39,202.117.112.3,10.177.15.166,435,Ether / IP / UDP / DNS Ans "b'interface.biliapi.com.'" ,53,52687,DNS,good
2021-04-25 14:17:39,10.177.15.166,122.246.9.8,74,Ether / IP / TCP 10.177.15.166:50992 > 122.246.9.8:https S,50992,443,HTTPS,good
2021-04-25 14:17:39,222.188.43.131,10.177.15.166,60,Ether / IP / TCP 222.188.43.131:https > 10.177.15.166:50959 R / Padding,443,50959,HTTPS,good
2021-04-25 14:17:39,222.188.43.131,10.177.15.166,60,Ether / IP / TCP 222.188.43.131:https > 10.177.15.166:50959 R / Padding,443,50959,HTTPS,good
2021-04-25 14:17:39,122.246.9.8,10.177.15.166,62,Ether / IP / TCP 122.246.9.8:https > 10.177.15.166:50992 SA,443,50992,HTTPS,good
2021-04-25 14:17:39,10.177.15.166,122.246.9.8,54,Ether / IP / TCP 10.177.15.166:50992 > 122.246.9.8:https A,50992,443,HTTPS,good
2021-04-25 14:17:39,10.177.15.166,122.246.9.8,571,Ether / IP / TCP / TLS 10.177.15.166:50992 > 122.246.9.8:443 / TLS / TLS Handshake - Client Hello,50992,443,HTTPS,good
2021-04-25 14:17:39,122.246.9.8,10.177.15.166,60,Ether / IP / TCP 122.246.9.8:https > 10.177.15.166:50992 A / Padding,443,50992,HTTPS,good
2021-04-25 14:17:39,122.246.9.8,10.177.15.166,1502,Ether / IP / TCP / TLS / TLS 122.246.9.8:443 > 10.177.15.166:50992 / TLS / Raw,443,50992,HTTPS,good
2021-04-25 14:17:39,122.246.9.8,10.177.15.166,1502,Ether / IP / TCP 122.246.9.8:https > 10.177.15.166:50992 A / _TLSEncryptedContent,443,50992,HTTPS,good
2021-04-25 14:17:39,122.246.9.8,10.177.15.166,1455,Ether / IP / TCP 122.246.9.8:https > 10.177.15.166:50992 PA / _TLSEncryptedContent,443,50992,HTTPS,good
2021-04-25 14:17:39,10.177.15.166,122.246.9.8,54,Ether / IP / TCP 10.177.15.166:50992 > 122.246.9.8:https A,50992,443,HTTPS,good
2021-04-25 14:17:39,10.177.15.166,122.246.9.8,180,Ether / IP / TCP / TLS / TLS / TLS 10.177.15.166:50992 > 122.246.9.8:443 / TLS / TLS Handshake - Hello Request / TLS Handshake - Hello Request / Raw,50992,443,HTTPS,good
2021-04-25 14:17:39,10.177.15.166,122.246.9.8,153,Ether / IP / TCP / TLS 10.177.15.166:50992 > 122.246.9.8:443 / TLS / TLS Application Data,50992,443,HTTPS,good
2021-04-25 14:17:39,10.177.15.166,122.246.9.8,1120,Ether / IP / TCP / TLS 10.177.15.166:50992 > 122.246.9.8:443 / TLS / TLS Application Data,50992,443,HTTPS,good
2021-04-25 14:17:39,122.246.9.8,10.177.15.166,312,Ether / IP / TCP / TLS / TLS / TLS 122.246.9.8:443 > 10.177.15.166:50992 / TLS / Raw,443,50992,HTTPS,good
2021-04-25 14:17:39,122.246.9.8,10.177.15.166,60,Ether / IP / TCP 122.246.9.8:https > 10.177.15.166:50992 A / Padding,443,50992,HTTPS,good
2021-04-25 14:17:39,10.177.15.166,122.246.9.8,54,Ether / IP / TCP 10.177.15.166:50992 > 122.246.9.8:https A,50992,443,HTTPS,good
2021-04-25 14:17:39,122.246.9.8,10.177.15.166,749,Ether / IP / TCP / TLS / TLS / TLS / TLS 122.246.9.8:443 > 10.177.15.166:50992 / TLS / TLS Application Data,443,50992,HTTPS,good
2021-04-25 14:17:39,10.177.15.166,122.246.9.8,92,Ether / IP / TCP / TLS 10.177.15.166:50992 > 122.246.9.8:443 / TLS / TLS Application Data,50992,443,HTTPS,good
2021-04-25 14:17:39,122.246.9.8,10.177.15.166,60,Ether / IP / TCP 122.246.9.8:https > 10.177.15.166:50992 A / Padding,443,50992,HTTPS,good
2021-04-25 14:17:41,10.177.15.166,180.101.49.54,672,Ether / IP / TCP / TLS 10.177.15.166:50977 > 180.101.49.54:443 / TLS / TLS Application Data,50977,443,HTTPS,good
2021-04-25 14:17:41,180.101.49.54,10.177.15.166,60,Ether / IP / TCP 180.101.49.54:https > 10.177.15.166:50977 A / Padding,443,50977,HTTPS,good
2021-04-25 14:17:41,180.101.49.54,10.177.15.166,116,Ether / IP / TCP / TLS 180.101.49.54:443 > 10.177.15.166:50977 / TLS / TLS Application Data,443,50977,HTTPS,good
2021-04-25 14:17:41,10.177.15.166,120.133.59.12,74,Ether / IP / TCP 10.177.15.166:50993 > 120.133.59.12:https S,50993,443,HTTPS,good
2021-04-25 14:17:41,10.177.15.166,180.101.49.54,54,Ether / IP / TCP 10.177.15.166:50977 > 180.101.49.54:https A,50977,443,HTTPS,good
2021-04-25 14:17:41,120.133.59.12,10.177.15.166,66,Ether / IP / TCP 120.133.59.12:https > 10.177.15.166:50993 SA,443,50993,HTTPS,good
2021-04-25 14:17:41,10.177.15.166,202.117.112.3,91,Ether / IP / UDP / DNS Qry "b'settings-win.data.microsoft.com.'" ,62473,53,DNS,good
2021-04-25 14:17:41,202.117.112.3,10.177.15.166,197,Ether / IP / UDP / DNS Ans "b'settingsfd-geo.trafficmanager.net.'" ,53,62473,DNS,good
2021-04-25 14:17:41,10.177.15.166,52.139.168.125,74,Ether / IP / TCP 10.177.15.166:50994 > 52.139.168.125:https S,50994,443,HTTPS,good
2021-04-25 14:17:41,52.139.168.125,10.177.15.166,66,Ether / IP / TCP 52.139.168.125:https > 10.177.15.166:50994 SA,443,50994,HTTPS,good
2021-04-25 14:17:41,10.177.15.166,52.139.168.125,54,Ether / IP / TCP 10.177.15.166:50994 > 52.139.168.125:https A,50994,443,HTTPS,good
2021-04-25 14:17:41,10.177.15.166,52.139.168.125,264,Ether / IP / TCP / TLS 10.177.15.166:50994 > 52.139.168.125:443 / TLS / TLS Handshake - Client Hello,50994,443,HTTPS,good
2021-04-25 14:17:41,52.139.168.125,10.177.15.166,1502,Ether / IP / TCP / TLS 52.139.168.125:443 > 10.177.15.166:50994 / TLS / TLS Handshake - Server Hello / Raw,443,50994,HTTPS,good
2021-04-25 14:17:41,52.139.168.125,10.177.15.166,1502,Ether / IP / TCP 52.139.168.125:https > 10.177.15.166:50994 A / _TLSEncryptedContent,443,50994,HTTPS,good
2021-04-25 14:17:41,52.139.168.125,10.177.15.166,851,Ether / IP / TCP 52.139.168.125:https > 10.177.15.166:50994 PA / _TLSEncryptedContent,443,50994,HTTPS,good
2021-04-25 14:17:41,10.177.15.166,52.139.168.125,54,Ether / IP / TCP 10.177.15.166:50994 > 52.139.168.125:https A,50994,443,HTTPS,good
2021-04-25 14:17:41,10.177.15.166,52.139.168.125,147,Ether / IP / TCP / TLS / TLS / TLS 10.177.15.166:50994 > 52.139.168.125:443 / TLS / TLS Handshake - Hello Request / TLS Handshake - Hello Request / Raw,50994,443,HTTPS,good
2021-04-25 14:17:41,52.139.168.125,10.177.15.166,105,Ether / IP / TCP / TLS / TLS 52.139.168.125:443 > 10.177.15.166:50994 / TLS / TLS Handshake - Hello Request / TLS Handshake - Hello Request / Raw,443,50994,HTTPS,good
2021-04-25 14:17:41,52.139.168.125,10.177.15.166,123,Ether / IP / TCP / TLS 52.139.168.125:443 > 10.177.15.166:50994 / TLS / TLS Application Data,443,50994,HTTPS,good
2021-04-25 14:17:41,10.177.15.166,52.139.168.125,54,Ether / IP / TCP 10.177.15.166:50994 > 52.139.168.125:https A,50994,443,HTTPS,good
2021-04-25 14:17:41,10.177.15.166,52.139.168.125,141,Ether / IP / TCP / TLS 10.177.15.166:50994 > 52.139.168.125:443 / TLS / TLS Application Data,50994,443,HTTPS,good
2021-04-25 14:17:41,10.177.15.166,52.139.168.125,968,Ether / IP / TCP / TLS 10.177.15.166:50994 > 52.139.168.125:443 / TLS / TLS Application Data,50994,443,HTTPS,good
2021-04-25 14:17:41,10.177.15.166,52.139.168.125,92,Ether / IP / TCP / TLS 10.177.15.166:50994 > 52.139.168.125:443 / TLS / TLS Application Data,50994,443,HTTPS,good
2021-04-25 14:17:41,52.139.168.125,10.177.15.166,60,Ether / IP / TCP 52.139.168.125:https > 10.177.15.166:50994 A / Padding,443,50994,HTTPS,good
2021-04-25 14:17:41,52.139.168.125,10.177.15.166,92,Ether / IP / TCP / TLS 52.139.168.125:443 > 10.177.15.166:50994 / TLS / TLS Application Data,443,50994,HTTPS,good
2021-04-25 14:17:41,52.139.168.125,10.177.15.166,193,Ether / IP / TCP / TLS 52.139.168.125:443 > 10.177.15.166:50994 / TLS / TLS Application Data,443,50994,HTTPS,good
2021-04-25 14:17:41,10.177.15.166,52.139.168.125,54,Ether / IP / TCP 10.177.15.166:50994 > 52.139.168.125:https A,50994,443,HTTPS,good
2021-04-25 14:17:41,10.177.15.166,52.139.168.125,54,Ether / IP / TCP 10.177.15.166:50994 > 52.139.168.125:https FA,50994,443,HTTPS,good
2021-04-25 14:17:41,10.177.15.166,120.133.59.12,74,Ether / IP / TCP 10.177.15.166:50995 > 120.133.59.12:https S,50995,443,HTTPS,good
2021-04-25 14:17:41,10.177.15.166,120.133.59.12,74,Ether / IP / TCP 10.177.15.166:50996 > 120.133.59.12:https S,50996,443,HTTPS,good
2021-04-25 14:17:41,10.177.15.166,58.222.35.204,55,Ether / IP / TCP 10.177.15.166:50989 > 58.222.35.204:https A / _TLSEncryptedContent,50989,443,HTTPS,good
2021-04-25 14:17:41,58.222.35.204,10.177.15.166,66,Ether / IP / TCP 58.222.35.204:https > 10.177.15.166:50989 A,443,50989,HTTPS,good
2021-04-25 14:17:41,120.133.59.12,10.177.15.166,66,Ether / IP / TCP 120.133.59.12:https > 10.177.15.166:50995 SA,443,50995,HTTPS,good
2021-04-25 14:17:41,120.133.59.12,10.177.15.166,66,Ether / IP / TCP 120.133.59.12:https > 10.177.15.166:50996 SA,443,50996,HTTPS,good
2021-04-25 14:17:41,10.177.15.166,120.133.59.12,54,Ether / IP / TCP 10.177.15.166:50995 > 120.133.59.12:https A,50995,443,HTTPS,good
2021-04-25 14:17:41,10.177.15.166,120.133.59.12,54,Ether / IP / TCP 10.177.15.166:50996 > 120.133.59.12:https A,50996,443,HTTPS,good
2021-04-25 14:17:41,10.177.15.166,120.133.59.12,233,Ether / IP / TCP / TLS 10.177.15.166:50996 > 120.133.59.12:443 / TLS / TLS Handshake - Client Hello,50996,443,HTTPS,good
2021-04-25 14:17:41,10.177.15.166,120.133.59.12,233,Ether / IP / TCP / TLS 10.177.15.166:50995 > 120.133.59.12:443 / TLS / TLS Handshake - Client Hello,50995,443,HTTPS,good
2021-04-25 14:17:41,52.139.168.125,10.177.15.166,60,Ether / IP / TCP 52.139.168.125:https > 10.177.15.166:50994 FA / Padding,443,50994,HTTPS,good
2021-04-25 14:17:41,10.177.15.166,52.139.168.125,54,Ether / IP / TCP 10.177.15.166:50994 > 52.139.168.125:https A,50994,443,HTTPS,good
2021-04-25 14:17:41,120.133.59.12,10.177.15.166,60,Ether / IP / TCP 120.133.59.12:https > 10.177.15.166:50995 A / Padding,443,50995,HTTPS,good
2021-04-25 14:17:41,10.177.15.166,13.107.42.23,55,Ether / IP / TCP 10.177.15.166:50988 > 13.107.42.23:https A / _TLSEncryptedContent,50988,443,HTTPS,good
2021-04-25 14:17:41,120.133.59.12,10.177.15.166,60,Ether / IP / TCP 120.133.59.12:https > 10.177.15.166:50996 A / Padding,443,50996,HTTPS,good
2021-04-25 14:17:41,120.133.59.12,10.177.15.166,1502,Ether / IP / TCP / TLS / TLS 120.133.59.12:443 > 10.177.15.166:50995 / TLS / Raw,443,50995,HTTPS,good
2021-04-25 14:17:41,120.133.59.12,10.177.15.166,1502,Ether / IP / TCP 120.133.59.12:https > 10.177.15.166:50995 A / _TLSEncryptedContent,443,50995,HTTPS,good
2021-04-25 14:17:41,120.133.59.12,10.177.15.166,551,Ether / IP / TCP 120.133.59.12:https > 10.177.15.166:50995 PA / _TLSEncryptedContent,443,50995,HTTPS,good
2021-04-25 14:17:41,10.177.15.166,120.133.59.12,54,Ether / IP / TCP 10.177.15.166:50995 > 120.133.59.12:https A,50995,443,HTTPS,good
2021-04-25 14:17:41,10.177.15.166,120.133.59.12,147,Ether / IP / TCP / TLS / TLS / TLS 10.177.15.166:50995 > 120.133.59.12:443 / TLS / TLS Handshake - Hello Request / TLS Handshake - Hello Request / Raw,50995,443,HTTPS,good
2021-04-25 14:17:41,120.133.59.12,10.177.15.166,1502,Ether / IP / TCP / TLS / TLS 120.133.59.12:443 > 10.177.15.166:50996 / TLS / Raw,443,50996,HTTPS,good
2021-04-25 14:17:41,120.133.59.12,10.177.15.166,1502,Ether / IP / TCP 120.133.59.12:https > 10.177.15.166:50996 A / _TLSEncryptedContent,443,50996,HTTPS,good
2021-04-25 14:17:42,120.133.59.12,10.177.15.166,66,Ether / IP / TCP 120.133.59.12:https > 10.177.15.166:50993 SA,443,50993,HTTPS,good
2021-04-25 14:17:42,192.144.198.149,10.177.15.166,60,Ether / IP / TCP 192.144.198.149:7826 > 10.177.15.166:50865 A / Padding,7826,50865,TCP,good
2021-04-25 14:17:42,10.177.15.166,192.144.198.149,54,Ether / IP / TCP 10.177.15.166:50865 > 192.144.198.149:7826 A,50865,7826,TCP,good
2021-04-25 14:17:43,10.177.15.166,192.144.198.149,192,Ether / IP / TCP 10.177.15.166:50869 > 192.144.198.149:7826 PA / Raw,50869,7826,TCP,good
2021-04-25 14:17:43,192.144.198.149,10.177.15.166,186,Ether / IP / TCP 192.144.198.149:7826 > 10.177.15.166:50869 PA / Raw,7826,50869,TCP,good
2021-04-25 14:17:43,10.177.15.166,192.144.198.149,54,Ether / IP / TCP 10.177.15.166:50869 > 192.144.198.149:7826 A,50869,7826,TCP,good
2021-04-25 14:17:43,10.177.15.166,13.107.42.23,55,Ether / IP / TCP 10.177.15.166:50987 > 13.107.42.23:https A / _TLSEncryptedContent,50987,443,HTTPS,good
2021-04-25 14:17:43,10.177.15.166,180.101.49.54,1502,Ether / IP / TCP / TLS 10.177.15.166:50898 > 180.101.49.54:443 / TLS / TLS Application Data,50898,443,HTTPS,good
2021-04-25 14:17:43,10.177.15.166,180.101.49.54,1502,Ether / IP / TCP 10.177.15.166:50898 > 180.101.49.54:https A / _TLSEncryptedContent,50898,443,HTTPS,good
2021-04-25 14:17:43,10.177.15.166,180.101.49.54,778,Ether / IP / TCP 10.177.15.166:50898 > 180.101.49.54:https PA / _TLSEncryptedContent,50898,443,HTTPS,good
2021-04-25 14:17:43,180.101.49.54,10.177.15.166,60,Ether / IP / TCP 180.101.49.54:https > 10.177.15.166:50898 A / Padding,443,50898,HTTPS,good
2021-04-25 14:17:43,180.101.49.54,10.177.15.166,60,Ether / IP / TCP 180.101.49.54:https > 10.177.15.166:50898 A / Padding,443,50898,HTTPS,good
2021-04-25 14:17:43,180.101.49.54,10.177.15.166,340,Ether / IP / TCP / TLS 180.101.49.54:443 > 10.177.15.166:50898 / TLS / TLS Application Data,443,50898,HTTPS,good
2021-04-25 14:17:43,180.101.49.54,10.177.15.166,195,Ether / IP / TCP / TLS 180.101.49.54:443 > 10.177.15.166:50898 / TLS / TLS Application Data,443,50898,HTTPS,good
2021-04-25 14:17:43,10.177.15.166,180.101.49.54,54,Ether / IP / TCP 10.177.15.166:50898 > 180.101.49.54:https A,50898,443,HTTPS,good
2021-04-25 14:17:43,13.107.42.23,10.177.15.166,66,Ether / IP / TCP 13.107.42.23:https > 10.177.15.166:50987 A,443,50987,HTTPS,good
2021-04-25 14:17:43,180.101.49.54,10.177.15.166,195,Ether / IP / TCP / TLS 180.101.49.54:443 > 10.177.15.166:50898 / TLS / TLS Application Data,443,50898,HTTPS,good
2021-04-25 14:17:43,10.177.15.166,180.101.49.54,66,Ether / IP / TCP 10.177.15.166:50898 > 180.101.49.54:https A,50898,443,HTTPS,good
2021-04-25 14:17:43,10.177.15.166,13.67.52.249,74,Ether / IP / TCP 10.177.15.166:50990 > 13.67.52.249:https S,50990,443,HTTPS,good
2021-04-25 14:17:44,10.177.15.166,180.101.49.54,672,Ether / IP / TCP / TLS 10.177.15.166:50977 > 180.101.49.54:443 / TLS / TLS Application Data,50977,443,HTTPS,good
2021-04-25 14:17:44,180.101.49.54,10.177.15.166,60,Ether / IP / TCP 180.101.49.54:https > 10.177.15.166:50977 A / Padding,443,50977,HTTPS,good
2021-04-25 14:17:44,180.101.49.54,10.177.15.166,116,Ether / IP / TCP / TLS 180.101.49.54:443 > 10.177.15.166:50977 / TLS / TLS Application Data,443,50977,HTTPS,good
2021-04-25 14:17:44,10.177.15.166,180.101.49.54,54,Ether / IP / TCP 10.177.15.166:50977 > 180.101.49.54:https A,50977,443,HTTPS,good
2021-04-25 14:17:45,10.177.15.166,192.144.198.149,192,Ether / IP / TCP 10.177.15.166:50862 > 192.144.198.149:7826 PA / Raw,50862,7826,TCP,good
2021-04-25 14:17:45,192.144.198.149,10.177.15.166,186,Ether / IP / TCP 192.144.198.149:7826 > 10.177.15.166:50862 PA / Raw,7826,50862,TCP,good
2021-04-25 14:17:45,10.177.15.166,192.144.198.149,54,Ether / IP / TCP 10.177.15.166:50862 > 192.144.198.149:7826 A,50862,7826,TCP,good
2021-04-25 14:17:46,10.177.15.166,120.133.59.12,54,Ether / IP / TCP 10.177.15.166:50996 > 120.133.59.12:https RA,50996,443,HTTPS,good
2021-04-25 14:17:46,10.177.15.166,120.133.59.12,54,Ether / IP / TCP 10.177.15.166:50995 > 120.133.59.12:https RA,50995,443,HTTPS,good
2021-04-25 14:17:47,10.177.15.166,180.101.49.54,672,Ether / IP / TCP / TLS 10.177.15.166:50977 > 180.101.49.54:443 / TLS / TLS Application Data,50977,443,HTTPS,good
2021-04-25 14:17:47,180.101.49.54,10.177.15.166,60,Ether / IP / TCP 180.101.49.54:https > 10.177.15.166:50977 A / Padding,443,50977,HTTPS,good
2021-04-25 14:17:47,180.101.49.54,10.177.15.166,116,Ether / IP / TCP / TLS 180.101.49.54:443 > 10.177.15.166:50977 / TLS / TLS Application Data,443,50977,HTTPS,good
2021-04-25 14:17:47,10.177.15.166,180.101.49.54,54,Ether / IP / TCP 10.177.15.166:50977 > 180.101.49.54:https A,50977,443,HTTPS,good
2021-04-25 14:17:48,10.177.15.166,192.144.198.149,192,Ether / IP / TCP 10.177.15.166:50865 > 192.144.198.149:7826 PA / Raw,50865,7826,TCP,good
2021-04-25 14:17:48,192.144.198.149,10.177.15.166,186,Ether / IP / TCP 192.144.198.149:7826 > 10.177.15.166:50865 PA / Raw,7826,50865,TCP,good
2021-04-25 14:17:48,10.177.15.166,192.144.198.149,54,Ether / IP / TCP 10.177.15.166:50865 > 192.144.198.149:7826 A,50865,7826,TCP,good
2021-04-25 14:17:50,10.177.15.166,180.101.49.54,672,Ether / IP / TCP / TLS 10.177.15.166:50977 > 180.101.49.54:443 / TLS / TLS Application Data,50977,443,HTTPS,good
2021-04-25 14:17:50,180.101.49.54,10.177.15.166,60,Ether / IP / TCP 180.101.49.54:https > 10.177.15.166:50977 A / Padding,443,50977,HTTPS,good
2021-04-25 14:17:50,180.101.49.54,10.177.15.166,116,Ether / IP / TCP / TLS 180.101.49.54:443 > 10.177.15.166:50977 / TLS / TLS Application Data,443,50977,HTTPS,good
2021-04-25 14:17:50,10.177.15.166,180.101.49.54,54,Ether / IP / TCP 10.177.15.166:50977 > 180.101.49.54:https A,50977,443,HTTPS,good
2021-04-25 14:17:52,10.177.15.166,223.252.199.69,68,Ether / IP / TCP 10.177.15.166:50886 > 223.252.199.69:6004 PA / Raw,50886,6004,TCP,good
2021-04-25 14:17:52,223.252.199.69,10.177.15.166,68,Ether / IP / TCP 223.252.199.69:6004 > 10.177.15.166:50886 PA / Raw,6004,50886,TCP,good
2021-04-25 14:17:52,10.177.15.166,223.252.199.69,66,Ether / IP / TCP 10.177.15.166:50886 > 223.252.199.69:6004 A,50886,6004,TCP,good
2021-04-25 14:17:53,10.177.15.166,192.144.198.149,219,Ether / IP / TCP 10.177.15.166:50869 > 192.144.198.149:7826 PA / Raw,50869,7826,TCP,good
2021-04-25 14:17:53,10.177.15.166,180.101.49.54,672,Ether / IP / TCP / TLS 10.177.15.166:50977 > 180.101.49.54:443 / TLS / TLS Application Data,50977,443,HTTPS,good
2021-04-25 14:17:53,192.144.198.149,10.177.15.166,218,Ether / IP / TCP 192.144.198.149:7826 > 10.177.15.166:50869 PA / Raw,7826,50869,TCP,good
2021-04-25 14:17:53,180.101.49.54,10.177.15.166,60,Ether / IP / TCP 180.101.49.54:https > 10.177.15.166:50977 A / Padding,443,50977,HTTPS,good
2021-04-25 14:17:53,180.101.49.54,10.177.15.166,116,Ether / IP / TCP / TLS 180.101.49.54:443 > 10.177.15.166:50977 / TLS / TLS Application Data,443,50977,HTTPS,good
2021-04-25 14:17:53,10.177.15.166,192.144.198.149,54,Ether / IP / TCP 10.177.15.166:50869 > 192.144.198.149:7826 A,50869,7826,TCP,good
2021-04-25 14:17:53,10.177.15.166,180.101.49.54,54,Ether / IP / TCP 10.177.15.166:50977 > 180.101.49.54:https A,50977,443,HTTPS,good
2021-04-25 14:17:54,10.177.15.166,192.144.198.149,218,Ether / IP / TCP 10.177.15.166:50862 > 192.144.198.149:7826 PA / Raw,50862,7826,TCP,good
2021-04-25 14:17:55,10.177.15.166,180.101.49.54,1502,Ether / IP / TCP / TLS 10.177.15.166:50898 > 180.101.49.54:443 / TLS / TLS Application Data,50898,443,HTTPS,good
2021-04-25 14:17:55,10.177.15.166,180.101.49.54,1502,Ether / IP / TCP 10.177.15.166:50898 > 180.101.49.54:https A / _TLSEncryptedContent,50898,443,HTTPS,good
2021-04-25 14:17:55,10.177.15.166,180.101.49.54,778,Ether / IP / TCP 10.177.15.166:50898 > 180.101.49.54:https PA / _TLSEncryptedContent,50898,443,HTTPS,good
2021-04-25 14:17:55,180.101.49.54,10.177.15.166,60,Ether / IP / TCP 180.101.49.54:https > 10.177.15.166:50898 A / Padding,443,50898,HTTPS,good
2021-04-25 14:17:55,180.101.49.54,10.177.15.166,60,Ether / IP / TCP 180.101.49.54:https > 10.177.15.166:50898 A / Padding,443,50898,HTTPS,good
2021-04-25 14:17:55,180.101.49.54,10.177.15.166,340,Ether / IP / TCP / TLS 180.101.49.54:443 > 10.177.15.166:50898 / TLS / TLS Application Data,443,50898,HTTPS,good
2021-04-25 14:17:55,180.101.49.54,10.177.15.166,195,Ether / IP / TCP / TLS 180.101.49.54:443 > 10.177.15.166:50898 / TLS / TLS Application Data,443,50898,HTTPS,good
2021-04-25 14:17:55,10.177.15.166,180.101.49.54,54,Ether / IP / TCP 10.177.15.166:50898 > 180.101.49.54:https A,50898,443,HTTPS,good
2021-04-25 14:17:55,180.101.49.54,10.177.15.166,195,Ether / IP / TCP / TLS 180.101.49.54:443 > 10.177.15.166:50898 / TLS / TLS Application Data,443,50898,HTTPS,good
2021-04-25 14:17:55,10.177.15.166,180.101.49.54,66,Ether / IP / TCP 10.177.15.166:50898 > 180.101.49.54:https A,50898,443,HTTPS,good
2021-04-25 14:17:55,10.177.15.166,202.117.112.3,78,Ether / IP / UDP / DNS Qry "b'edge.microsoft.com.'" ,63918,53,DNS,good
2021-04-25 14:17:55,202.117.112.3,10.177.15.166,160,Ether / IP / UDP / DNS Ans "b'edge-microsoft-com.a-0016.a-msedge.net.'" ,53,63918,DNS,good
2021-04-25 14:17:55,10.177.15.166,204.79.197.219,74,Ether / IP / TCP 10.177.15.166:50997 > 204.79.197.219:https S,50997,443,HTTPS,good
2021-04-25 14:17:55,204.79.197.219,10.177.15.166,66,Ether / IP / TCP 204.79.197.219:https > 10.177.15.166:50997 SA,443,50997,HTTPS,good
2021-04-25 14:17:55,10.177.15.166,204.79.197.219,54,Ether / IP / TCP 10.177.15.166:50997 > 204.79.197.219:https A,50997,443,HTTPS,good
2021-04-25 14:17:55,10.177.15.166,204.79.197.219,571,Ether / IP / TCP / TLS 10.177.15.166:50997 > 204.79.197.219:443 / TLS / TLS Handshake - Client Hello,50997,443,HTTPS,good
2021-04-25 14:17:55,204.79.197.219,10.177.15.166,60,Ether / IP / TCP 204.79.197.219:https > 10.177.15.166:50997 A / Padding,443,50997,HTTPS,good
2021-04-25 14:17:55,204.79.197.219,10.177.15.166,1502,Ether / IP / TCP / TLS 204.79.197.219:443 > 10.177.15.166:50997 / TLS / TLS Handshake - Server Hello / Raw,443,50997,HTTPS,good
2021-04-25 14:17:55,204.79.197.219,10.177.15.166,1502,Ether / IP / TCP 204.79.197.219:https > 10.177.15.166:50997 A / _TLSEncryptedContent,443,50997,HTTPS,good
2021-04-25 14:17:55,204.79.197.219,10.177.15.166,1502,Ether / IP / TCP 204.79.197.219:https > 10.177.15.166:50997 A / _TLSEncryptedContent,443,50997,HTTPS,good
2021-04-25 14:17:55,204.79.197.219,10.177.15.166,1263,Ether / IP / TCP 204.79.197.219:https > 10.177.15.166:50997 PA / _TLSEncryptedContent,443,50997,HTTPS,good
2021-04-25 14:17:55,10.177.15.166,204.79.197.219,54,Ether / IP / TCP 10.177.15.166:50997 > 204.79.197.219:https A,50997,443,HTTPS,good
2021-04-25 14:17:55,10.177.15.166,204.79.197.219,212,Ether / IP / TCP / TLS / TLS / TLS 10.177.15.166:50997 > 204.79.197.219:443 / TLS / TLS Handshake - Hello Request / TLS Handshake - Hello Request / Raw,50997,443,HTTPS,good
2021-04-25 14:17:55,10.177.15.166,204.79.197.219,153,Ether / IP / TCP / TLS 10.177.15.166:50997 > 204.79.197.219:443 / TLS / TLS Application Data,50997,443,HTTPS,good
2021-04-25 14:17:55,10.177.15.166,204.79.197.219,944,Ether / IP / TCP / TLS 10.177.15.166:50997 > 204.79.197.219:443 / TLS / TLS Application Data,50997,443,HTTPS,good
2021-04-25 14:17:55,10.177.15.166,204.79.197.219,1494,Ether / IP / TCP / TLS 10.177.15.166:50997 > 204.79.197.219:443 / TLS / TLS Application Data,50997,443,HTTPS,good
2021-04-25 14:17:55,10.177.15.166,204.79.197.219,1494,Ether / IP / TCP 10.177.15.166:50997 > 204.79.197.219:https A / _TLSEncryptedContent,50997,443,HTTPS,good
2021-04-25 14:17:55,10.177.15.166,204.79.197.219,621,Ether / IP / TCP 10.177.15.166:50997 > 204.79.197.219:https PA / _TLSEncryptedContent,50997,443,HTTPS,good
2021-04-25 14:17:55,204.79.197.219,10.177.15.166,60,Ether / IP / TCP 204.79.197.219:https > 10.177.15.166:50997 A / Padding,443,50997,HTTPS,good
2021-04-25 14:17:55,204.79.197.219,10.177.15.166,60,Ether / IP / TCP 204.79.197.219:https > 10.177.15.166:50997 A / Padding,443,50997,HTTPS,good
2021-04-25 14:17:55,204.79.197.219,10.177.15.166,60,Ether / IP / TCP 204.79.197.219:https > 10.177.15.166:50997 A / Padding,443,50997,HTTPS,good
2021-04-25 14:17:55,204.79.197.219,10.177.15.166,105,Ether / IP / TCP / TLS / TLS 204.79.197.219:443 > 10.177.15.166:50997 / TLS / TLS Handshake - Hello Request / TLS Handshake - Hello Request / Raw,443,50997,HTTPS,good
2021-04-25 14:17:55,204.79.197.219,10.177.15.166,123,Ether / IP / TCP / TLS 204.79.197.219:443 > 10.177.15.166:50997 / TLS / TLS Application Data,443,50997,HTTPS,good
2021-04-25 14:17:55,204.79.197.219,10.177.15.166,92,Ether / IP / TCP / TLS 204.79.197.219:443 > 10.177.15.166:50997 / TLS / TLS Application Data,443,50997,HTTPS,good
2021-04-25 14:17:55,204.79.197.219,10.177.15.166,60,Ether / IP / TCP 204.79.197.219:https > 10.177.15.166:50997 A / Padding,443,50997,HTTPS,good
2021-04-25 14:17:55,10.177.15.166,204.79.197.219,54,Ether / IP / TCP 10.177.15.166:50997 > 204.79.197.219:https A,50997,443,HTTPS,good
2021-04-25 14:17:55,10.177.15.166,204.79.197.219,92,Ether / IP / TCP / TLS 10.177.15.166:50997 > 204.79.197.219:443 / TLS / TLS Application Data,50997,443,HTTPS,good
2021-04-25 14:17:55,204.79.197.219,10.177.15.166,334,Ether / IP / TCP / TLS 204.79.197.219:443 > 10.177.15.166:50997 / TLS / TLS Application Data,443,50997,HTTPS,good
2021-04-25 14:17:55,204.79.197.219,10.177.15.166,185,Ether / IP / TCP / TLS 204.79.197.219:443 > 10.177.15.166:50997 / TLS / TLS Application Data,443,50997,HTTPS,good
2021-04-25 14:17:55,204.79.197.219,10.177.15.166,1502,Ether / IP / TCP / TLS 204.79.197.219:443 > 10.177.15.166:50997 / TLS / TLS Application Data,443,50997,HTTPS,good
2021-04-25 14:17:55,204.79.197.219,10.177.15.166,173,Ether / IP / TCP 204.79.197.219:https > 10.177.15.166:50997 PA / _TLSEncryptedContent,443,50997,HTTPS,good
2021-04-25 14:17:55,10.177.15.166,204.79.197.219,54,Ether / IP / TCP 10.177.15.166:50997 > 204.79.197.219:https A,50997,443,HTTPS,good
2021-04-25 14:17:55,204.79.197.219,10.177.15.166,92,Ether / IP / TCP / TLS 204.79.197.219:443 > 10.177.15.166:50997 / TLS / TLS Application Data,443,50997,HTTPS,good
2021-04-25 14:17:56,10.177.15.166,204.79.197.219,54,Ether / IP / TCP 10.177.15.166:50997 > 204.79.197.219:https A,50997,443,HTTPS,good
2021-04-25 14:17:56,204.79.197.219,10.177.15.166,60,Ether / IP / TCP 204.79.197.219:https > 10.177.15.166:50997 A / Padding,443,50997,HTTPS,good
2021-04-25 14:17:56,10.177.15.166,202.117.112.3,72,Ether / IP / UDP / DNS Qry "b'www.bing.com.'" ,55288,53,DNS,good
2021-04-25 14:17:56,202.117.112.3,10.177.15.166,237,Ether / IP / UDP / DNS Ans "b'a-0001.a-afdentry.net.trafficmanager.net.'" ,53,55288,DNS,good
2021-04-25 14:17:56,10.177.15.166,202.89.233.101,74,Ether / IP / TCP 10.177.15.166:50998 > 202.89.233.101:https S,50998,443,HTTPS,good
2021-04-25 14:17:56,202.89.233.101,10.177.15.166,66,Ether / IP / TCP 202.89.233.101:https > 10.177.15.166:50998 SA,443,50998,HTTPS,good
2021-04-25 14:17:56,10.177.15.166,202.89.233.101,54,Ether / IP / TCP 10.177.15.166:50998 > 202.89.233.101:https A,50998,443,HTTPS,good
2021-04-25 14:17:56,202.89.233.101,10.177.15.166,568,Ether / IP / TCP / TLS 202.89.233.101:443 > 10.177.15.166:50998 / TLS / TLS Application Data,443,50998,HTTPS,good
2021-04-25 14:17:56,202.89.233.101,10.177.15.166,92,Ether / IP / TCP / TLS 202.89.233.101:443 > 10.177.15.166:50998 / TLS / TLS Application Data,443,50998,HTTPS,good
2021-04-25 14:17:56,10.177.15.166,202.89.233.101,54,Ether / IP / TCP 10.177.15.166:50998 > 202.89.233.101:https A,50998,443,HTTPS,good
2021-04-25 14:17:56,10.177.15.166,202.117.112.3,71,Ether / IP / UDP / DNS Qry "b'cn.bing.com.'" ,60559,53,DNS,good
2021-04-25 14:17:56,202.117.112.3,10.177.15.166,182,Ether / IP / UDP / DNS Ans "b'cn-bing-com.cn.a-0001.a-msedge.net.'" ,53,60559,DNS,good
2021-04-25 14:17:56,10.177.15.166,202.89.233.101,1494,Ether / IP / TCP / TLS 10.177.15.166:50998 > 202.89.233.101:443 / TLS / TLS Application Data,50998,443,HTTPS,good
2021-04-25 14:17:56,10.177.15.166,202.89.233.101,714,Ether / IP / TCP 10.177.15.166:50998 > 202.89.233.101:https PA / _TLSEncryptedContent,50998,443,HTTPS,good
2021-04-25 14:17:56,202.89.233.101,10.177.15.166,60,Ether / IP / TCP 202.89.233.101:https > 10.177.15.166:50998 A / Padding,443,50998,HTTPS,good
2021-04-25 14:17:56,202.89.233.101,10.177.15.166,654,Ether / IP / TCP / TLS 202.89.233.101:443 > 10.177.15.166:50998 / TLS / TLS Application Data,443,50998,HTTPS,good
2021-04-25 14:17:56,202.89.233.101,10.177.15.166,92,Ether / IP / TCP / TLS 202.89.233.101:443 > 10.177.15.166:50998 / TLS / TLS Application Data,443,50998,HTTPS,good
2021-04-25 14:17:56,10.177.15.166,202.89.233.101,54,Ether / IP / TCP 10.177.15.166:50998 > 202.89.233.101:https A,50998,443,HTTPS,good
2021-04-25 14:17:56,10.177.15.166,180.101.49.54,672,Ether / IP / TCP / TLS 10.177.15.166:50977 > 180.101.49.54:443 / TLS / TLS Application Data,50977,443,HTTPS,good
2021-04-25 14:17:56,180.101.49.54,10.177.15.166,60,Ether / IP / TCP 180.101.49.54:https > 10.177.15.166:50977 A / Padding,443,50977,HTTPS,good
2021-04-25 14:17:56,180.101.49.54,10.177.15.166,116,Ether / IP / TCP / TLS 180.101.49.54:443 > 10.177.15.166:50977 / TLS / TLS Application Data,443,50977,HTTPS,good
2021-04-25 14:17:56,58.222.35.204,10.177.15.166,100,Ether / IP / TCP / TLS 58.222.35.204:443 > 10.177.15.166:50989 / TLS / TLS Application Data,443,50989,HTTPS,good
